Person_ID,Name,Title,Institution,Start_Year,End_Year,Source,Notes
P031,Alikhan Zhamsatov,"Deputy Head, State Control Department",Akorda,2024,2025,,
P031,Alikhan Zhamsatov,Head of State Control Department,Akorda,2025,Present,,
P032,Ruslan Turganaly,"Expert, Chief Expert",Ministry of Justice,2009,2011,,
P032,Ruslan Turganaly,"Expert, Consultant, Inspector, State and Legal Department",Akorda,2011,2016,,
P032,Ruslan Turganaly,"Inspector, Head of Sector, Civil Service and Personnel Policy Department",Akorda,2016,2018,,
P032,Ruslan Turganaly,Head of Human Resources Department,Ministry of National Economy,2018,2019,,
P032,Ruslan Turganaly,"Head of Sector, Civil Service and Personnel Policy Department",Akorda,2019,2021,,
P032,Ruslan Turganaly,"Deputy Head, Civil Service and Personnel Policy Department",Akorda,2021,2022,,
P032,Ruslan Turganaly,Head of Civil Service and Personnel Policy Department,Akorda,2022,2023,,
P032,Ruslan Turganaly,Head of Civil Service Department,Akorda,2023,Present,,
P033,Zhandos Imanaliyev,"Specialist, Consular Service Department",Ministry of Foreign Affairs (MFA),2013,2014,,
P033,Zhandos Imanaliyev,"Attache, Third, Second Secretary, Multilateral Cooperation Department",Ministry of Foreign Affairs (MFA),2014,2017,,
P033,Zhandos Imanaliyev,"Third, Second, First Secretary",Embassy of Kazakhstan in the United States (MFA),2017,2021,,
P033,Zhandos Imanaliyev,"Expert, Consultant (Special Representative for International Cooperation support)",Akorda,2021,2022,,
P033,Zhandos Imanaliyev,"Head of Sector, Foreign Policy and International Relations Department",Akorda,2022,2023,,
P033,Zhandos Imanaliyev,"Deputy Head, Foreign Policy Department",Akorda,2023,2025,,
P033,Zhandos Imanaliyev,Head of Foreign Policy Department,Akorda,2025,Present,,